Name,URL,Age in 2020,Gender,Role,From,Until
"Chan, Dennis Kwok Leung 陳國樑",sfclicrec.asp?p=105105,,M,RO,2016-11-02,
"Chiu, Man Hon (SFC:AAA833) 趙文康",sfclicrec.asp?p=85491,,,Rep,2017-01-13,2017-10-06
"Li, Ying Kin (SFC:BBE439) 李應健",sfclicrec.asp?p=2059147,,,Rep,2016-11-23,2017-02-14
"Lo, Chi Man (SFC:AJB649) 羅志文",sfclicrec.asp?p=112789,,,RO,2018-05-10,
"Tang, Wai Yi 鄧惠儀",sfclicrec.asp?p=72827,,,Rep,2017-04-06,2017-05-26
"Tang, Wai Yi 鄧惠儀",sfclicrec.asp?p=72827,,,RO,2017-05-26,
"Wong, Man Chun (SFC:APQ127) 黃文俊",sfclicrec.asp?p=97355,,,Rep,2017-10-27,2018-01-22
"Yiu, Chi Wah (SFC:ACT308) 姚志華",sfclicrec.asp?p=92386,,M,RO,2016-11-02,2017-05-31
