Name,URL,Age in 2020,Gender,Role,From,Until
"Chak, Alan Wing Kai 翟永基",sfclicrec.asp?p=88728,,M,RO,2016-01-28,
"Cheng, Dominic Tin Han 鄭天行",sfclicrec.asp?p=92219,,M,RO,2016-01-28,
"Kam, Shou Him Thomas 甘守謙",sfclicrec.asp?p=133660,,,RO,2016-01-28,
"Kwan, Man Yee 關文懿",sfclicrec.asp?p=2564886,,,Rep,2017-07-12,2018-04-30
"Lo, Lok Hang 盧諾恒",sfclicrec.asp?p=2707068,,,Rep,2017-03-07,
"Tang, Winnie Wing Sze 鄧詠詩",sfclicrec.asp?p=89642,,F,Rep,2017-07-11,2018-05-31
"Tse, Wai Ming (SFC:AMZ184) 謝慧明",sfclicrec.asp?p=117810,,,RO,2016-01-28,2017-08-13
