Name,URL,Age in 2020,Gender,Role,From,Until
"Cheng, Chang Tze Tsu 鄭張子初",sfclicrec.asp?p=100868,,,Rep,,
"Cheng, Erik Ho Yan 鄭可仁",sfclicrec.asp?p=106035,,M,RO,,
"Cheng, Hok Wai (SFC:AAD167) 鄭學偉",sfclicrec.asp?p=100869,,M,RO,,
"Cheng, Yuk Tong 鄭鈺堂",sfclicrec.asp?p=100870,,,Rep,,2006-03-10
"Chiu, Kenny Kwun Chark 趙君澤",sfclicrec.asp?p=107513,,M,Rep,2003-09-29,
"Fang, Chun 樊珍",sfclicrec.asp?p=103929,,,Rep,,
"Ng, Sui Man 吳瑞民",sfclicrec.asp?p=100871,,,Rep,,2011-12-01
"Tsui, Yim Hing 徐艷卿",sfclicrec.asp?p=104454,,,Rep,,
"Tung, Lo Lar 董露娜",sfclicrec.asp?p=100571,,,Rep,2006-01-16,
