Name,URL,Age in 2020,Gender,Role,From,Until
"Fung, Ronald Man Dong 馮文讜",sfclicrec.asp?p=101320,,M,RO,,2018-12-10
"Lai, Chung Kwan 黎松坤",sfclicrec.asp?p=104414,,,Rep,,2009-02-01
"Lai, Kenneth Chung Hei 黎松禧",sfclicrec.asp?p=104396,,M,Rep,,2006-04-11
"Lai, Swana Mei Chun 黎美珍",sfclicrec.asp?p=100862,,F,RO,,
"Lam, Yip Chai (SFC:BOB934) 林曄際",sfclicrec.asp?p=22857613,,,Rep,2019-03-05,2019-03-11
"Lam, Yip Chai (SFC:BOB934) 林曄際",sfclicrec.asp?p=22857613,,,RO,2019-03-11,2019-04-24
"Lau, Hon Wai (SFC:ACI109) 劉漢威",sfclicrec.asp?p=78208,,,RO,2019-12-06,2020-01-19
"Lun, Shu Lam 倫樹霖",sfclicrec.asp?p=97642,,,Rep,2020-01-16,2020-01-21
"Lun, Shu Lam 倫樹霖",sfclicrec.asp?p=97642,,,RO,2020-01-21,
"Yuen, Ng Fung Kinky 袁伍鳳",sfclicrec.asp?p=23929532,,,Rep,2019-11-20,
