Name,URL,Age in 2020,Gender,Role,From,Until
"Chung, Hiu Mei 鍾曉薇",sfclicrec.asp?p=2461812,,,Rep,2017-02-27,2018-03-15
"Diu, Chin Fai 刁展輝",sfclicrec.asp?p=17732,,,RO,2014-03-18,2017-06-13
"Fung, Raymond Kwok Hung 馮國洪",sfclicrec.asp?p=16566,63,M,RO,2017-02-16,
"Lee, Nancy Shuk Ying 李淑英",sfclicrec.asp?p=101412,,F,RO,2014-03-18,2014-08-15
"Tam, Howard King Ho 譚景豪",sfclicrec.asp?p=35092,57,M,RO,2014-03-18,2017-01-22
"Wong, Kai Ho 黃啟豪",sfclicrec.asp?p=2227246,,,Rep,2015-09-23,2016-12-31
"Yan, King Tang 甄景騰",sfclicrec.asp?p=102640,,,RO,2017-06-22,
