Name,URL,Age in 2020,Gender,Role,From,Until
"Cheung, Pui Ling 張佩玲",sfclicrec.asp?p=115572,,,Rep,2005-05-05,2018-02-27
"Cheung, Pui Ling 張佩玲",sfclicrec.asp?p=115572,,,RO,2018-02-27,
"Fung, Yet Chi 馮若池",sfclicrec.asp?p=102361,,,Rep,,2007-08-22
"Fung, Yet Chi 馮若池",sfclicrec.asp?p=102361,,,RO,2007-08-22,
"Liu, Chung Tong (SFC:AUK189) 廖頌棠",sfclicrec.asp?p=12508323,,,Rep,2017-11-16,2018-05-16
"Liu, James Ying Yin 廖英賢",sfclicrec.asp?p=101328,74,M,RO,,
"Liu, Joanna Chung Yan 廖頌恩",sfclicrec.asp?p=106215,,F,Rep,,2019-08-16
"Ng, Shirley Shuk Yee 吳淑儀",sfclicrec.asp?p=102237,,F,RO,,2006-04-09
"Soo, Hung Kin 蘇洪堅",sfclicrec.asp?p=101334,,,Rep,,2009-03-06
"Tam, Diana Shuk Tuen 譚淑端",sfclicrec.asp?p=100790,,F,Rep,,2014-10-18
