Name,URL,Age in 2020,Gender,Role,From,Until
"Au, Chi Fai 區志輝",sfclicrec.asp?p=103189,,,Rep,,2003-05-02
"Au, Shing Ho 歐成河",sfclicrec.asp?p=81667,,,Rep,,2016-05-23
"Chan, Chi Wo 陳志和",sfclicrec.asp?p=2654134,,,Rep,2018-10-03,
"Chan, Chiu On 陳超安",sfclicrec.asp?p=2483281,,,Rep,2015-12-10,2017-02-06
"Chan, Chung Leung (SFC:AEF867) 陳仲良",sfclicrec.asp?p=94304,,,RO,2017-04-25,2017-12-06
"Chan, Chung Leung (SFC:AEF867) 陳仲良",sfclicrec.asp?p=94304,,,Rep,2017-12-06,2018-07-31
"Chan, Dominic Lap Yan 陳立仁",sfclicrec.asp?p=81668,,M,Rep,,2015-02-02
"Chan, Ka Lee (SFC:BCT961) 陳嘉莉",sfclicrec.asp?p=2198893,,,Rep,2014-01-22,2014-03-19
"Chan, Kit Wai 陳傑偉",sfclicrec.asp?p=82089,,,Rep,2019-07-16,
"Chan, Kwong Yuen (SFC:BGN069) 陳廣源",sfclicrec.asp?p=2502054,,,Rep,2018-04-20,2019-10-15
"Chan, Sau Han 陳秀嫻",sfclicrec.asp?p=77846,,,Rep,2016-10-24,2017-03-05
"Chan, Shut Sang 陳述生",sfclicrec.asp?p=2639545,,,Rep,2018-10-09,2019-11-29
"Chan, Siu Ling 陳小鈴",sfclicrec.asp?p=2269660,,,Rep,2015-04-14,2017-01-01
"Chan, So Fan 陳素芬",sfclicrec.asp?p=81670,,,Rep,,
"Chan, Wai Lam (SFC:AZF439) 陳偉林",sfclicrec.asp?p=1872801,,,Rep,2014-04-10,2014-04-24
"Chan, Windy Sau Ha 陳秀霞",sfclicrec.asp?p=81669,,,Rep,,
"Chen, Liuqing (SFC:BEB063) 陳柳青",sfclicrec.asp?p=2310864,,,Rep,2014-08-20,
"Cheng, Chi Ming (SFC:AKP072) 鄭致明",sfclicrec.asp?p=81671,,,Rep,2008-10-13,
"Cheuk, Chun Wa 卓俊華",sfclicrec.asp?p=104579,,,Rep,,2003-07-01
"Cheung, Chui Yee 張翠儀",sfclicrec.asp?p=82126,,,Rep,2013-04-12,2015-09-18
"Cheung, Fei Chau 張菲洲",sfclicrec.asp?p=70931,,,Rep,2014-05-14,2015-05-18
"Cheung, Ka Man (SFC:BFZ630) 張嘉雯",sfclicrec.asp?p=2462453,,,Rep,2018-05-16,
"Cheung, Kwok Yan 張國仁",sfclicrec.asp?p=94331,,,Rep,2014-11-13,2017-10-31
"Cheung, Lai Ping (SFC:ACJ211) 張麗萍",sfclicrec.asp?p=78840,,F,Rep,2015-12-17,2016-08-26
"Cheung, Man Keung 張文強",sfclicrec.asp?p=81672,,,Rep,2009-08-20,2012-06-07
"Cheung, Man Yu (SFC:ADV638) 張文裕",sfclicrec.asp?p=70933,,,Rep,,2008-01-05
"Cheung, Priscilla Yuk Ping 張玉屏",sfclicrec.asp?p=81673,,F,Rep,,2012-01-10
"Cheung, Priscilla Yuk Ping 張玉屏",sfclicrec.asp?p=81673,,F,RO,2012-01-10,2014-04-16
"Cheung, Priscilla Yuk Ping 張玉屏",sfclicrec.asp?p=81673,,F,Rep,2014-04-16,
"Cheung, Sandra Wing Yi 張詠儀",sfclicrec.asp?p=94333,,F,Rep,2014-11-13,2018-09-16
"Cheung, Tony Hoi Cheung 張凱翔",sfclicrec.asp?p=127065,,M,Rep,2008-11-06,2009-04-21
"Chiu, Philip Ho Hei 趙可喜",sfclicrec.asp?p=81674,,M,Rep,,
"Chiu, Pui Yu 趙沛宇",sfclicrec.asp?p=71774,,,Rep,2014-02-27,2016-01-13
"Chiu, Pui Yu 趙沛宇",sfclicrec.asp?p=71774,,,RO,2016-01-13,2016-06-24
"Chiu, Wing 趙榮",sfclicrec.asp?p=110371,,,Rep,,2003-05-02
"Choi, Chung Tin 蔡仲天",sfclicrec.asp?p=68565,,,Rep,2013-12-11,2016-03-24
"Choi, Siu Shun 蔡紹舜",sfclicrec.asp?p=81675,,,Rep,,2017-05-12
"Chong, Ka Hei 莊嘉熙",sfclicrec.asp?p=2200641,,,Rep,2014-01-27,2015-07-16
"Chong, Ka Yee 莊嘉誼",sfclicrec.asp?p=82142,37,M,RO,2016-09-13,
"Chow, Ho Suen 鄒昊璿",sfclicrec.asp?p=94780,,,Rep,2007-07-20,2008-04-12
"Chow, Ming Wai 周明偉",sfclicrec.asp?p=82147,,,Rep,2013-04-18,2015-06-29
"Chow, Ming Wai 周明偉",sfclicrec.asp?p=82147,,,RO,2015-06-29,2016-06-29
"Chow, Wing Lam 周永林",sfclicrec.asp?p=81676,,,Rep,,
"Choy, Stanley Ka Man 蔡嘉文",sfclicrec.asp?p=2553980,,M,Rep,2016-04-01,2016-11-10
"Chui, Charles Kin Wai 崔堅偉",sfclicrec.asp?p=2528615,,M,Rep,2019-03-08,2019-11-01
"Chung, Fai Lam 鍾輝霖",sfclicrec.asp?p=81677,,,Rep,,
"Dou, Ruirui 竇瑞瑞",sfclicrec.asp?p=84937,,,Rep,2013-11-04,2013-12-31
"Fung, Hon Wa 馮漢華",sfclicrec.asp?p=71500,,,Rep,2014-07-18,2017-02-28
"Fung, So Man 馮素敏",sfclicrec.asp?p=81678,,,Rep,2006-04-12,2012-02-29
"Fung, Stella Siu Wan 馮少雲",sfclicrec.asp?p=22366,65,F,RO,,2004-04-30
"Ho, Elaine Yuen Ying 何婉盈",sfclicrec.asp?p=81681,,F,Rep,2011-01-20,2012-07-07
"Ho, Hok Ling 何鶴齡",sfclicrec.asp?p=117905,,,Rep,2010-08-16,2011-06-10
"Ho, Kwan Hung (SFC:AMC556) 何鈞雄",sfclicrec.asp?p=82175,,,Rep,2017-10-06,
"Ho, Sai Ho (SFC:AOH660) 何世豪",sfclicrec.asp?p=90120,,,Rep,2015-06-12,2015-08-06
"Ho, Wai Chi (SFC:ABZ276) 何慧之",sfclicrec.asp?p=81680,,,Rep,,
"Ho, Wing Cheong (SFC:AAH181) 何榮昌",sfclicrec.asp?p=81662,,,RO,,2016-02-16
"Hui, Ka Ming (SFC:AOB414) 許加明",sfclicrec.asp?p=119882,,,Rep,2008-05-26,2010-06-27
"Hui, Pak Yuen 許柏源",sfclicrec.asp?p=2158095,,,Rep,2017-11-24,2019-02-10
"Hung, Leo Wai Choi 洪偉財",sfclicrec.asp?p=97747,,M,Rep,2018-04-24,
"Ip, Kun Ming 葉貫明",sfclicrec.asp?p=2446600,,,Rep,2019-02-15,
"Kam, Man Wai 甘敏慧",sfclicrec.asp?p=2084722,,,Rep,2013-06-14,2014-06-23
"Kan, Lok Him 簡樂謙",sfclicrec.asp?p=2581339,,,Rep,2016-05-23,2018-05-04
"Ku, Yiu Fai 古耀輝",sfclicrec.asp?p=81682,,,Rep,2011-09-14,2013-07-26
"Kwan, Yee Kwan 關綺筠",sfclicrec.asp?p=81683,,,Rep,2011-06-24,2012-12-14
"Kwok, Wing Lun 郭詠麟",sfclicrec.asp?p=118018,,,Rep,2013-08-15,2016-08-17
"Lai, Chi Kin (SFC:ABR456) 黎志堅",sfclicrec.asp?p=82209,,,Rep,2013-04-18,2016-08-22
"Lai, Yiu Ting 黎耀庭",sfclicrec.asp?p=2618970,,,Rep,2016-08-12,2018-12-04
"Lam, Ka Ho (SFC:AXP757) 林家豪",sfclicrec.asp?p=95000,,,Rep,2017-08-09,2018-08-31
"Lam, Ka Hou 林家豪",sfclicrec.asp?p=82217,,,Rep,2013-04-29,2015-09-18
"Lam, Ka Wai (SFC:BDM257) 林家威",sfclicrec.asp?p=2272691,,,Rep,2014-05-23,2016-04-08
"Lam, Kam Chun (SFC:AAP928) 林錦珍",sfclicrec.asp?p=81685,,,Rep,,2019-12-31
"Lam, Maat Sheung Chiu 林襄潮",sfclicrec.asp?p=94381,,,Rep,2014-11-13,
"Lam, Man Ho (SFC:ARQ371) 林文浩",sfclicrec.asp?p=126764,,,Rep,2016-05-03,2016-10-29
"Lam, Wing Him (SFC:ASD008) 林永謙",sfclicrec.asp?p=127220,,,Rep,2009-07-15,2011-05-21
"Lau, Ava Chui Wah 劉翠華",sfclicrec.asp?p=81686,,,Rep,2006-12-06,2012-03-02
"Lau, Ching Yin Judy 劉靜妍",sfclicrec.asp?p=2394713,,,Rep,2015-03-19,2019-06-15
"Lau, Kar Shun Carson 劉家順",sfclicrec.asp?p=2588279,,,Rep,2016-06-06,2017-10-03
"Lau, Kwan Ming 劉君明",sfclicrec.asp?p=2591674,,,Rep,2016-06-14,2017-04-12
"Lau, Kwo 劉戈",sfclicrec.asp?p=81687,,,Rep,2007-12-17,2017-02-24
"Lau, Mei King 柳美琼",sfclicrec.asp?p=78870,,,Rep,2016-03-16,2016-08-18
"Lau, Shun Pui 劉順培",sfclicrec.asp?p=81663,,,RO,2005-08-03,2013-03-01
"Lau, Yee Ching 劉宜靜",sfclicrec.asp?p=81688,,,Rep,,2014-05-12
"Lau, Yi 劉怡",sfclicrec.asp?p=22239784,,,Rep,2018-10-05,2018-11-12
"Lee, Wai Keung (SFC:ANT413) 李偉強",sfclicrec.asp?p=82245,,,Rep,2016-07-28,2018-02-28
"Lee, Yuen Tsun 李遠浚",sfclicrec.asp?p=2654137,,,Rep,2017-07-12,2019-10-24
"Leung, Ausca Wai Lan 梁惠蘭",sfclicrec.asp?p=81664,,,Rep,2005-08-24,2007-06-18
"Leung, Ausca Wai Lan 梁惠蘭",sfclicrec.asp?p=81664,,,RO,2007-06-18,2011-10-25
"Leung, Chi Ming (SFC:AAF501) 梁志明",sfclicrec.asp?p=92295,,,Rep,2016-08-12,2016-09-29
"Leung, Chi Ming (SFC:AAF501) 梁志明",sfclicrec.asp?p=92295,,,RO,2016-09-29,2018-07-31
"Leung, Heidi Chinn Hay 梁芊栩",sfclicrec.asp?p=114499,,F,Rep,2004-09-10,2006-04-01
"Leung, Ho Yim 梁顥嚴",sfclicrec.asp?p=2386077,,,Rep,2017-06-27,2018-07-06
"Leung, Kit Piu 梁傑彪",sfclicrec.asp?p=81689,,,Rep,2008-08-18,2014-08-11
"Leung, Phoebe Wai Fong 梁惠芳",sfclicrec.asp?p=81690,,F,Rep,,
"Li, Chun Kei (SFC:AKJ732) 李振基",sfclicrec.asp?p=78879,,,Rep,2016-01-15,2016-04-18
"Li, Chun Kei (SFC:AKJ732) 李振基",sfclicrec.asp?p=78879,,,RO,2016-04-18,2016-08-09
"Li, Chun Wai (SFC:APF581) 李鎮偉",sfclicrec.asp?p=81691,,,Rep,2011-08-11,2013-10-02
"Li, Eliza Lan Seung 李蘭嫦",sfclicrec.asp?p=81692,,F,Rep,,2012-01-10
"Li, Eliza Lan Seung 李蘭嫦",sfclicrec.asp?p=81692,,F,RO,2012-01-10,2015-07-27
"Li, Eliza Lan Seung 李蘭嫦",sfclicrec.asp?p=81692,,F,Rep,2015-07-27,
"Li, Kwan Kim 李群劍",sfclicrec.asp?p=85095,,,Rep,2007-10-11,2008-01-04
"Li, Pui 李培",sfclicrec.asp?p=2335966,,,Rep,2016-04-20,2017-05-19
"Li, Yuk Ping (SFC:ADV175) 李玉冰",sfclicrec.asp?p=104239,,,Rep,2010-02-17,2010-03-12
"Liu, Jielan 劉潔蘭",sfclicrec.asp?p=121329,,,Rep,2007-08-21,2007-12-06
"Lo, Cheuk Sing 羅焯星",sfclicrec.asp?p=81693,,,Rep,,2013-05-06
"Lo, Eric Yam Pui 盧任培",sfclicrec.asp?p=82068,,M,Rep,2018-09-05,2018-12-13
"Lok, Chiu Chan 駱昭塵",sfclicrec.asp?p=2056013,,,Rep,2013-10-09,2016-10-31
"Lui, Sung Hing 呂崇興",sfclicrec.asp?p=2382151,,,Rep,2017-12-22,2018-07-25
"Lui, Yat Yin 呂逸賢",sfclicrec.asp?p=91229,,,Rep,2018-02-28,2018-11-04
"Lun, Ka Lai 倫家禮",sfclicrec.asp?p=81694,,,Rep,2010-06-07,2012-06-12
"Ma, Chau Ho 馬秋豪",sfclicrec.asp?p=71834,,,Rep,2012-08-07,2014-05-12
"Man, Ka Lai (SFC:AWP883) 文嘉麗",sfclicrec.asp?p=71838,,,Rep,2016-04-15,2016-05-09
"Mau, Julie Mei Chu 茅美珠",sfclicrec.asp?p=81695,,F,Rep,,2017-01-01
"Mo, Rena Choi Ying 毛賽英",sfclicrec.asp?p=81696,,F,Rep,,
"Mui, Tsz Ching 梅子青",sfclicrec.asp?p=78255,,,Rep,2010-12-24,2011-03-31
"Ng, Chi Hung (SFC:APK407) 吳子雄",sfclicrec.asp?p=85147,,,Rep,2007-08-16,2009-06-18
"Ng, Kwok Leung (SFC:ADV349) 吳國良",sfclicrec.asp?p=58361,,M,Rep,,2007-06-13
"Ng, Wai Yip 吳偉業",sfclicrec.asp?p=128300,,,Rep,2009-08-25,2010-12-01
"Ng, Wai 吳煒",sfclicrec.asp?p=99147,,,Rep,2009-08-31,2009-10-09
"Ngai, King Man 魏靖悠",sfclicrec.asp?p=91801,,,Rep,2015-05-04,2015-11-11
"Ong, Tiang Lock 王添樂",sfclicrec.asp?p=58063,62,M,Rep,2011-06-23,2011-08-15
"Ong, Tiang Lock 王添樂",sfclicrec.asp?p=58063,62,M,RO,2011-08-15,2013-10-07
"Pak, Ka Lee 白嘉莉",sfclicrec.asp?p=2257951,,,Rep,2016-11-10,
"Pun, Hong Hai 潘康海",sfclicrec.asp?p=82303,42,M,Rep,2012-07-05,2013-04-15
"Pun, Hong Hai 潘康海",sfclicrec.asp?p=82303,42,M,RO,2013-04-15,2015-08-14
"Pun, Hong Hai 潘康海",sfclicrec.asp?p=82303,42,M,RO,2016-07-12,2016-09-30
"Remedios, Angela Maria ",sfclicrec.asp?p=108467,,F,Rep,2003-05-20,2005-04-06
"Shao, Yingda 邵穎達",sfclicrec.asp?p=2173696,,,Rep,2014-01-21,2017-05-31
"Shek, Fung (SFC:AKO844) 石豐",sfclicrec.asp?p=78266,,,Rep,2013-04-22,2015-04-25
"Shum, Yuen Fai 沈遠輝",sfclicrec.asp?p=91814,,,Rep,2014-01-22,2015-02-09
"Sun, Ying (SFC:AVD529) 孫穎",sfclicrec.asp?p=129740,,,Rep,2010-05-05,2011-06-29
"Sze, Ching Lau 施清流",sfclicrec.asp?p=74343,,,Rep,,2003-11-01
"Tam, Kin Kei 譚健基",sfclicrec.asp?p=1939830,,,Rep,2014-03-19,2015-09-15
"Tam, Wai Ching 談慧貞",sfclicrec.asp?p=81697,,,Rep,,2017-01-01
"Tam, Yat Kan 譚逸勤",sfclicrec.asp?p=94760,,,Rep,2013-03-22,2014-03-28
"Tan, Lim Heng 陳林興",sfclicrec.asp?p=1756,72,M,RO,,2016-02-16
"Tang, Justin Chi Yuen 鄧志遠",sfclicrec.asp?p=71151,,M,Rep,2014-06-09,2014-12-22
"Tang, Nick Chi Yuen 鄧智遠",sfclicrec.asp?p=82320,,,Rep,2018-01-04,2018-01-18
"Tang, Nick Chi Yuen 鄧智遠",sfclicrec.asp?p=82320,,,RO,2018-01-18,2019-07-31
"Ting, Sai Man 丁世民",sfclicrec.asp?p=80353,,,Rep,2017-10-18,2017-12-05
"Ting, Sai Man 丁世民",sfclicrec.asp?p=80353,,,RO,2017-12-05,
"To, Ting Fung 杜霆鋒",sfclicrec.asp?p=82327,,,Rep,2017-10-06,2019-01-11
"To, Wing Tung 杜泳潼",sfclicrec.asp?p=2665581,,,Rep,2018-01-17,2018-04-13
"Tsang, Wai Nam 曾惠南",sfclicrec.asp?p=2384846,,,Rep,2015-07-08,2016-12-14
"Tse, Kai Ming 謝佳明",sfclicrec.asp?p=23026302,,,Rep,2019-04-08,2019-05-29
"Tse, Lok Sang 謝樂生",sfclicrec.asp?p=2679172,,,Rep,2018-04-24,2018-09-26
"Tse, Yu Hung 謝宇雄",sfclicrec.asp?p=82334,,,Rep,2010-03-24,2010-08-02
"Tsoi, Chun Sing 蔡震星",sfclicrec.asp?p=2618971,,,Rep,2016-08-12,2017-08-31
"Tsui, Chek Ming 徐澤明",sfclicrec.asp?p=71170,,,Rep,2017-03-27,2017-06-30
"Wang, Yayuan 王雅媛",sfclicrec.asp?p=94441,35,F,Rep,2016-07-19,2017-10-31
"Wong, Ching (SFC:AXN060) 王靜",sfclicrec.asp?p=71679,,,Rep,2018-11-16,2019-02-23
"Wong, Dorothy Vienna Sze Wan 黃詩韻",sfclicrec.asp?p=102724,,F,Rep,,2003-05-02
"Wong, Hoi Ki 黃海祺",sfclicrec.asp?p=82349,,,Rep,2013-04-18,2015-11-05
"Wong, Hoi Ki 黃海祺",sfclicrec.asp?p=82349,,,RO,2015-11-05,2017-07-28
"Wong, Judy Ming Kuen 黃明娟",sfclicrec.asp?p=94738,,F,RO,2004-08-19,2005-08-19
"Wong, Kam Wing (SFC:AAE562) 黃錦榮",sfclicrec.asp?p=94448,,,Rep,2014-11-13,2015-08-26
"Wong, Siu Leung 黃紹良",sfclicrec.asp?p=69848,,,Rep,2014-12-03,2017-04-25
"Wong, Siu Leung 黃紹良",sfclicrec.asp?p=69848,,,RO,2017-04-25,2017-06-23
"Wong, Wei Man 王慧敏",sfclicrec.asp?p=82362,,,Rep,2017-10-06,2017-11-09
"Yang, Fan (SFC:ARD258) 楊帆",sfclicrec.asp?p=125521,,,Rep,2008-05-28,2008-10-25
"Yap, Boh Gee 葉謀義",sfclicrec.asp?p=81700,,,Rep,,2019-06-14
"Yau, Angela Shing Yam 邱聖音",sfclicrec.asp?p=117418,49,F,Rep,2005-11-17,2008-08-21
"Yau, Angela Shing Yam 邱聖音",sfclicrec.asp?p=117418,49,F,RO,2008-08-21,2011-06-30
"Yeung, Shu Fan 楊樹勳",sfclicrec.asp?p=94265,,M,Rep,2016-11-09,2017-01-05
"Yeung, Shu Fan 楊樹勳",sfclicrec.asp?p=94265,,M,RO,2017-01-05,2017-11-10
"Yiu, Ho Ching 姚浩清",sfclicrec.asp?p=107361,,,Rep,2006-06-16,2007-06-28
"Yu, Nga Shan 俞雅珊",sfclicrec.asp?p=90171,,,Rep,2016-02-22,2016-08-26
"Yuen, Ching Yiu 阮靜瑤",sfclicrec.asp?p=2592888,,,Rep,2018-05-16,
