Name,URL,Age in 2020,Gender,Role,From,Until
"Cheung, Koon Wai 張冠偉",sfclicrec.asp?p=122019,,,Rep,2016-06-06,2016-11-21
"Cheung, Koon Wai 張冠偉",sfclicrec.asp?p=122019,,,RO,2016-11-21,2017-04-19
"Chung, Chui Yi 鍾翠儀",sfclicrec.asp?p=127323,,,Rep,2009-02-25,2010-02-18
"Chung, Chui Yi 鍾翠儀",sfclicrec.asp?p=127323,,,RO,2010-02-18,
"Chung, Hon Sze 鍾瀚葹",sfclicrec.asp?p=103944,,,RO,2008-11-05,
"Harris, Kylie Jane ",sfclicrec.asp?p=112508,,F,RO,2008-11-05,2010-02-19
"Petersohn, Steven Jeffrey ",sfclicrec.asp?p=101962,,M,Rep,2017-06-07,
"Van Drasek, Dean Scott ",sfclicrec.asp?p=68547,,M,RO,2016-07-29,
"Wong, Andrew Yui Cheong 黃裔昌",sfclicrec.asp?p=2384861,,M,Rep,2016-06-06,
"Wong, Sze Fei 黃詩慧",sfclicrec.asp?p=129916,,,Rep,2015-01-19,
