Name,URL,Age in 2020,Gender,Role,From,Until
"Chan, Shun Faat 陳順發",sfclicrec.asp?p=2340551,,,Rep,2014-11-03,2016-09-08
"Mak, Yin Chong 麥燕莊",sfclicrec.asp?p=128700,,,Rep,2016-09-22,2017-09-07
"Mak, Yin Chong 麥燕莊",sfclicrec.asp?p=128700,,,Rep,2019-06-11,2019-06-17
"Mak, Yin Chong 麥燕莊",sfclicrec.asp?p=128700,,,RO,2019-06-17,
"Mantel, Andrew Pieter 莫昂迪",sfclicrec.asp?p=99653,,M,RO,,
"Tam, Yau Yee 譚祐怡",sfclicrec.asp?p=78613,,,RO,2006-11-17,2009-06-01
"Tse, Candy Yin Ping 謝燕萍",sfclicrec.asp?p=99655,,F,RO,2005-06-06,
"Wong, Ho Chun (SFC:AZF907) 王浩俊",sfclicrec.asp?p=2340552,33,M,Rep,2014-11-03,2016-09-08
