Name,URL,Age in 2020,Gender,Role,From,Until
"Chu, Steven Chun Hin (SFC:AMS312) 朱振軒",sfclicrec.asp?p=97254,,M,Rep,2019-04-03,2019-04-16
"Chu, Steven Chun Hin (SFC:AMS312) 朱振軒",sfclicrec.asp?p=97254,,M,RO,2019-04-16,
"Fu, Ming (SFC:ATI402) 傅鳴",sfclicrec.asp?p=95461,,,Rep,2019-01-11,2019-01-21
"Fu, Ming (SFC:ATI402) 傅鳴",sfclicrec.asp?p=95461,,,RO,2019-01-21,
"Lam, Chun Yuk 林俊旭",sfclicrec.asp?p=91183,,,Rep,2019-06-04,2019-07-23
"Lam, Chun Yuk 林俊旭",sfclicrec.asp?p=91183,,,RO,2019-07-23,
"Pak, Chi Wing 白志頴",sfclicrec.asp?p=83379,,,RO,2018-09-21,2019-01-14
"Tsang, Ming Fung 曾銘楓",sfclicrec.asp?p=81576,,,RO,2018-09-21,2019-03-14
