Name,URL,Age in 2020,Gender,Role,From,Until
"Chan, Ho Ping (SFC:AVI833) 陳浩平",sfclicrec.asp?p=94993,,,RO,2019-01-23,
"Cheung, King Fai (SFC:AUH631) 張景輝",sfclicrec.asp?p=96059,,,RO,2017-07-28,
"Ip Yuen, Katherine King Wai 葉阮琼惠",sfclicrec.asp?p=100786,,F,RO,2005-03-24,2017-08-02
"Lee, Ching Choy 李正才",sfclicrec.asp?p=100783,,,RO,2005-03-24,2017-05-31
"Lo, Yin Yee 盧燕儀",sfclicrec.asp?p=84536,,,Rep,2017-10-25,2018-01-31
"Ma, Cheuk Nam 馬綽男",sfclicrec.asp?p=11732621,,,Rep,2017-07-05,
"Ma, Wai Shun 馬瑋遜",sfclicrec.asp?p=11784991,,,Rep,2017-08-03,
"Poon, Dixon Tit Chu 潘鐵柱",sfclicrec.asp?p=96075,,M,RO,2017-05-17,2019-01-11
"Wong, Yuet Wah (SFC:ABL776) 黃月華",sfclicrec.asp?p=102069,,,Rep,2005-03-24,
