Name,URL,Age in 2020,Gender,Role,From,Until
"Au, Yiu Fai 區耀輝",sfclicrec.asp?p=81743,,,RO,2017-01-03,2018-07-03
"Ho, Kim Kwong 何劍剛",sfclicrec.asp?p=130527,,,RO,2018-09-19,
"Hui, Wan Yee 許韻兒",sfclicrec.asp?p=68756,,,Rep,2019-05-15,
"Kwok, Sze Kong 郭詩江",sfclicrec.asp?p=95501,,,RO,2017-01-03,2018-01-17
"Tham, Anna Marie 譚妙芳",sfclicrec.asp?p=77137,,F,RO,2018-09-19,
"Tiu, Chi Shing 刁志誠",sfclicrec.asp?p=98690,,,Rep,2017-01-27,2018-12-31
"Tsang, Hing Hung (SFC:AFG417) 曾慶洪",sfclicrec.asp?p=2714121,,,Rep,2017-03-16,2018-12-31
"Tse, Kwun Yip 謝冠業",sfclicrec.asp?p=2537262,45,M,RO,2018-10-12,2019-10-31
"Wat, Hin Tat 屈顯達",sfclicrec.asp?p=67842,,,Rep,2017-01-27,2018-12-31
