Name,URL,Age in 2020,Gender,Role,From,Until
"Au, Chui Ying 歐翠瑩",sfclicrec.asp?p=122795,,,Rep,2007-09-07,2009-08-06
"Chan, Derek Chi Hung 陳志洪",sfclicrec.asp?p=56656,,M,Rep,2010-11-05,2010-12-22
"Chan, Derek Chi Hung 陳志洪",sfclicrec.asp?p=56656,,M,RO,2010-12-22,2013-10-10
"Chan, Hugo Yu Hang 陳宇恆",sfclicrec.asp?p=82429,,M,Rep,2009-09-14,2009-10-31
"Chan, King Lun (SFC:AWC183) 陳景麟",sfclicrec.asp?p=130424,,,Rep,2010-10-20,2011-06-08
"Chan, Mazy Man Sze 陳敏思",sfclicrec.asp?p=56660,,F,Rep,2010-11-19,2011-02-24
"Chan, Mazy Man Sze 陳敏思",sfclicrec.asp?p=56660,,F,RO,2011-02-24,2013-11-05
"Chan, Yin Tsung 陳彥璁",sfclicrec.asp?p=63997,41,M,Rep,2009-10-20,2009-12-12
"Chau, Amy Lok Yuen 周樂宛",sfclicrec.asp?p=73109,,F,Rep,2009-09-14,2010-09-16
"Chau, Shamrock Roy 周尚立",sfclicrec.asp?p=79626,,,Rep,,2005-07-18
"Chen, Chuan Mei 陳傳美",sfclicrec.asp?p=1894245,,,Rep,2012-05-14,2012-12-07
"Chen, Lichen 陳力琛",sfclicrec.asp?p=2424761,,,Rep,2016-11-15,2019-05-05
"Cheung, Tze Man 張子文",sfclicrec.asp?p=68377,,,Rep,2005-10-14,2007-10-12
"Chin, Sui Ying 錢瑞英",sfclicrec.asp?p=95732,,,Rep,2011-05-17,2013-10-09
"Chong, Kian Shing 張建成",sfclicrec.asp?p=80807,,,Rep,2007-08-09,2010-04-01
"Choy, Edmond Kwong Man 蔡廣孟",sfclicrec.asp?p=73670,,M,Rep,2007-06-14,2007-12-07
"Choy, Edmond Kwong Man 蔡廣孟",sfclicrec.asp?p=73670,,M,RO,2007-12-07,2010-03-25
"Chu, Pui Fan 朱佩芬",sfclicrec.asp?p=85557,,,Rep,2010-04-13,2011-02-24
"Chu, Ying (SFC:AQY614) 儲穎",sfclicrec.asp?p=73694,,,Rep,2010-03-24,2011-05-10
"Feng, Shiran (SFC:ARJ059) 馮詩然",sfclicrec.asp?p=88912,,,Rep,2018-07-18,2019-12-30
"Gan, Fang 甘芳",sfclicrec.asp?p=111218,,,Rep,2007-02-13,2007-05-25
"Gan, Fang 甘芳",sfclicrec.asp?p=111218,,,RO,2007-05-25,2007-12-01
"Gan, Ker Wei 顏可為",sfclicrec.asp?p=95733,,,Rep,2009-07-27,2012-01-13
"Gan, Ker Wei 顏可為",sfclicrec.asp?p=95733,,,RO,2012-01-13,2016-03-25
"Hong, Po Kat 孔宝吉",sfclicrec.asp?p=11712269,,,Rep,2017-07-03,
"Hui, David Lam Chiu 許林釗",sfclicrec.asp?p=67588,,,Rep,,2003-06-12
"Ip, Angel Kwok Yen 葉國欣",sfclicrec.asp?p=72915,,F,Rep,2010-05-12,2010-09-23
"Kim, Simon Dae-Oun ",sfclicrec.asp?p=129386,,M,Rep,2012-02-22,2014-05-28
"Kong, Lorraine Li Yi 龔立儀",sfclicrec.asp?p=95734,,F,Rep,2011-04-19,2011-09-16
"Kwan, Edmond Man Kit 關文傑",sfclicrec.asp?p=81950,49,M,Rep,2010-08-13,2010-10-13
"Kwan, Edmond Man Kit 關文傑",sfclicrec.asp?p=81950,49,M,RO,2010-10-13,2011-06-27
"Kwok, Chi Hin 郭志軒",sfclicrec.asp?p=2396972,,,Rep,2015-03-24,2017-02-03
"Kwok, Felix Wing Ho 郭永晧",sfclicrec.asp?p=73778,,M,Rep,2009-08-06,2012-11-15
"Kwong, Henry Yuk Ho 鄺鋈豪",sfclicrec.asp?p=95735,,M,Rep,2011-05-27,2012-05-16
"Kwong, Kai Hong 鄺啟康",sfclicrec.asp?p=73779,,,Rep,2007-07-24,2012-03-13
"Kwong, Kai Hong 鄺啟康",sfclicrec.asp?p=73779,,,RO,2012-03-13,2012-12-06
"Lai, Anthony King Yan (SFC:AGA420) 黎敬恩",sfclicrec.asp?p=95730,,M,Rep,2007-10-05,2010-07-13
"Lai, Anthony King Yan (SFC:AGA420) 黎敬恩",sfclicrec.asp?p=95730,,M,RO,2010-07-13,2011-10-22
"Lai, Tung Ming 賴東明",sfclicrec.asp?p=81959,,,Rep,2010-09-10,2011-06-24
"Lam, Derek Tak Wai 林德偉",sfclicrec.asp?p=2387866,,M,Rep,2018-12-17,2019-07-31
"Law, On Yee 羅安怡",sfclicrec.asp?p=95736,,,Rep,2011-02-25,2015-01-05
"Lee, Julian Pui Hang 李沛鏗",sfclicrec.asp?p=87373,,M,RO,2016-09-22,
"Lee, Ka Yan (SFC:AXX669) 李嘉欣",sfclicrec.asp?p=95737,,,Rep,2011-08-24,2013-01-05
"Lee, Man Na 李文娜",sfclicrec.asp?p=113724,,,Rep,2006-11-01,2008-12-17
"Li, Jack C F 李卓富",sfclicrec.asp?p=95744,,M,Rep,2010-01-18,2010-06-02
"Li, Zhongxia 李仲夏",sfclicrec.asp?p=87789,36,M,Rep,2014-01-02,2014-06-09
"Lin, Jenny Yan 林焱",sfclicrec.asp?p=1940184,49,F,Rep,2011-07-22,2011-08-20
"Mak, King Sau 麥敬修",sfclicrec.asp?p=40935,46,M,Rep,2003-07-22,2005-09-12
"Man, Hoi To 萬海韜",sfclicrec.asp?p=2542981,,,Rep,2016-03-04,
"Mok, Man On 莫文安",sfclicrec.asp?p=95608,,,Rep,2007-07-24,2012-12-07
"Ng, Charlotte Tan Hung 吳騰紅",sfclicrec.asp?p=97798,,F,Rep,2007-08-23,2011-06-16
"Ng, Charlotte Tan Hung 吳騰紅",sfclicrec.asp?p=97798,,F,Rep,2013-09-26,2014-01-03
"Ng, Charlotte Tan Hung 吳騰紅",sfclicrec.asp?p=97798,,F,RO,2014-01-03,2015-02-07
"Pang, Ka Yin (SFC:APP351) 彭嘉妍",sfclicrec.asp?p=87911,,,Rep,2017-01-13,2017-10-13
"She, Sam Ian 佘心恩",sfclicrec.asp?p=116861,,,Rep,2007-01-23,2007-07-14
"Shih, Veronica Yiu Man 施曉雯",sfclicrec.asp?p=95738,,F,Rep,2011-03-24,2012-06-07
"Shum, Eric Kam Chi 岑錦志",sfclicrec.asp?p=14364,,M,RO,,2010-07-10
"So, Adam Chunfung 蘇俊豐",sfclicrec.asp?p=116619,,M,Rep,2011-11-15,2014-06-25
"So, Han Meng Julian 蘇漢明",sfclicrec.asp?p=95638,,,Rep,2011-11-15,2014-06-22
"So, Kam Chung Kelvin 蘇錦聰",sfclicrec.asp?p=2310968,,,Rep,2015-04-16,2016-07-04
"Tam, Manus Ping Chung 譚炳松",sfclicrec.asp?p=2152,57,M,RO,,2016-12-31
"Tan, Vera Zi Lin 陳姿霖",sfclicrec.asp?p=95656,,F,Rep,2011-11-15,2014-10-25
"Tian, Xiaowei 田笑微",sfclicrec.asp?p=73738,,,Rep,2008-11-04,2009-05-19
"Wang, Yan (SFC:AVY251) 王昕",sfclicrec.asp?p=130343,,,Rep,2010-10-14,2011-03-01
"Wong, Chak Sang 王澤生",sfclicrec.asp?p=133891,,,Rep,2011-11-21,2013-05-03
"Wong, Chor Yan 黃楚恩",sfclicrec.asp?p=113756,,,Rep,2004-06-14,2005-10-04
"Wong, Christopher Wah Wing 王華榮",sfclicrec.asp?p=114436,,M,Rep,2006-07-07,2006-08-28
"Wong, Danny F 汪曉峰",sfclicrec.asp?p=39699,58,M,RO,,2005-04-12
"Wong, Ka Ho (SFC:AXX645) 王家豪",sfclicrec.asp?p=95739,,,Rep,2011-08-22,2016-02-14
"Wong, Ka Man (SFC:AEK749) 黃家文",sfclicrec.asp?p=77819,,,Rep,,2007-02-26
"Wong, Ka Man (SFC:AEK749) 黃家文",sfclicrec.asp?p=77819,,,RO,2007-02-26,2007-08-22
"Wong, Patrick Kwok Hing (SFC:AAB974) 黃國興",sfclicrec.asp?p=95686,,M,RO,2016-06-08,
"Wong, Po Chun (SFC:AJO445) 黃寶珍",sfclicrec.asp?p=76705,,,Rep,2004-05-31,2007-09-27
"Wong, Vicky Wai Ki 黃慧琪",sfclicrec.asp?p=111148,,F,Rep,,2003-11-07
"Wu, Haoyuan 伍浩元",sfclicrec.asp?p=1939284,,,Rep,2014-01-15,2015-01-15
"Yen, Tzu-han 嚴子涵",sfclicrec.asp?p=77660,,,Rep,2006-05-30,2006-11-17
"Yeu, Chiu Wah 姚昭華",sfclicrec.asp?p=77820,,,Rep,,2004-12-09
"Yeu, Chiu Wah 姚昭華",sfclicrec.asp?p=77820,,,RO,2004-12-09,2006-09-26
"Yeung, Kin Sing 楊健聲",sfclicrec.asp?p=75419,,,RO,2015-02-03,
"Yeung, Tsun Yin 楊俊賢",sfclicrec.asp?p=95740,,,Rep,2011-06-21,2011-10-04
"Yip, Sunny Kai Sun 葉啟燊",sfclicrec.asp?p=85552,,M,Rep,,2007-05-01
"Yu, Mengqi (SFC:BCP862) 于夢栖",sfclicrec.asp?p=2188279,,,Rep,2014-01-02,2014-10-09
"Yu, Wai Ping 俞維平",sfclicrec.asp?p=111167,,,Rep,,2011-07-06
"Zhan, Tao (SFC:AQZ719) 詹濤",sfclicrec.asp?p=88624,,,Rep,2013-11-12,2014-09-26
"Zhang, Xigang 張溪岡",sfclicrec.asp?p=112487,,,Rep,2003-05-17,2004-01-06
"Zhang, Yanyu 張彥瑜",sfclicrec.asp?p=1861829,,,Rep,2012-03-06,2012-07-17
"Zheng, Gang (SFC:AIN958) 鄭鋼",sfclicrec.asp?p=112208,,,Rep,,2007-06-16
