Name,URL,Age in 2020,Gender,Role,From,Until
"Cheung, Hung Fat 張洪發",sfclicrec.asp?p=87488,,,Rep,2016-03-29,2016-09-12
"Ching, Andy Seih Hong 程燮康",sfclicrec.asp?p=103328,,,RO,2012-12-14,
"Hu, Yi Ding 胡以定",sfclicrec.asp?p=102613,,,RO,2012-08-08,
"Ip, Kenneth Kar King 葉家敬",sfclicrec.asp?p=103138,,M,RO,2012-08-08,2012-12-14
"Liu, Tai Yum 廖大任",sfclicrec.asp?p=86362,,,RO,2016-08-09,
"Pang, Shun Tak Borody 彭順德",sfclicrec.asp?p=18750055,,,Rep,2018-07-06,
"Wai, Bob Chi Ho 衛致豪",sfclicrec.asp?p=77608,,M,Rep,2018-01-12,2018-11-30
"Wang, Chi Ming 王志明",sfclicrec.asp?p=2024402,,,Rep,2013-02-25,2016-11-18
