Name,URL,Age in 2020,Gender,Role,From,Until
"Chan, Tung Ching 陳冬青",sfclicrec.asp?p=96328,,,Rep,2017-12-22,
"Cheng, Wing Hung (SFC:AMA065) 鄭永雄",sfclicrec.asp?p=77761,,,RO,2017-07-11,2018-02-28
"Chiu, Yiu Wah 趙耀華",sfclicrec.asp?p=96329,,,Rep,2017-10-04,
"Hui, Chun Kwok 許鎮國",sfclicrec.asp?p=11793172,,,Rep,2018-01-18,2019-01-16
"Hui, Hok Suen 許學萱",sfclicrec.asp?p=96324,,,Rep,2017-10-04,2017-12-14
"Hui, Hok Suen 許學萱",sfclicrec.asp?p=96324,,,RO,2017-12-14,
"Lai, Kwok Kei 黎國基",sfclicrec.asp?p=2553979,,,Rep,2019-09-18,
"Lee, Man Yu 李敏如",sfclicrec.asp?p=1947497,,,RO,2017-07-11,
